{
  "request_contract_version": "1.0",
  "capability_id": "gamelift.capacity-adjustment",
  "idempotency_token": "idem_abcdefghijklmnopqrstuvwx",
  "proposal": {
    "fleet_id": "fleet-1234abcd-5678-90ef-a1b2-c3d4e5f60789",
    "location": "us-west-2",
    "requested": {
      "desired": 14,
      "minimum": 2,
      "maximum": 20
    }
  }
}
